{
  "dimensions": {
    "length": 12.0,
    "span": 2.55
  },
  "id": "starter-bus",
  "kind": "craft",
  "licence": "CC0-1.0",
  "matches": {
    "classes": [
      "bus"
    ],
    "default": false,
    "types": []
  },
  "model": {
    "byteLimit": 12796,
    "format": "glb",
    "id": "model",
    "path": "model.glb",
    "required": true,
    "sha256": "d62f4bf14878b9fa319d9bd834dd88adbca125863eaea43dd3de0048c10648f6"
  },
  "name": "City bus (starter)",
  "provenance": {
    "attribution": "City bus (starter), original work by the Here Above project",
    "sources": [
      "https://github.com/Here-and-Above/hereabove-content/tree/main/content/craft/transit/starter-bus"
    ]
  }
}
