{
  "dimensions": {
    "length": 23.05,
    "span": 25.3
  },
  "id": "peregrine",
  "kind": "craft",
  "licence": "CC0-1.0",
  "matches": {
    "classes": [
      "airplane"
    ],
    "default": true,
    "types": []
  },
  "model": {
    "byteLimit": 608864,
    "format": "glb",
    "id": "model",
    "path": "model.glb",
    "required": true,
    "sha256": "7baeb84f9b0f720710b4d216f54144e1c50cd565cb8848873f5a34ffa95fba4f"
  },
  "name": "OH-01 Peregrine",
  "provenance": {
    "attribution": "OH-01 Peregrine, original work by the Here Above project",
    "sources": [
      "https://github.com/purplecones/hereabove-content/tree/main/content/craft/aircraft/peregrine"
    ]
  }
}
