{
  "dimensions": {
    "length": 18.0,
    "span": 3.05
  },
  "id": "starter-subway-car",
  "kind": "craft",
  "licence": "CC0-1.0",
  "matches": {
    "classes": [
      "subway",
      "light-rail",
      "rail"
    ],
    "default": false,
    "types": []
  },
  "model": {
    "byteLimit": 10776,
    "format": "glb",
    "id": "model",
    "path": "model.glb",
    "required": true,
    "sha256": "6d08649790bbfcda427b8bbd7334cabb3541eed3d307e2d726c6d741c24e6091"
  },
  "name": "Subway car (starter)",
  "provenance": {
    "attribution": "Subway car (starter), original work by the Here Above project",
    "sources": [
      "https://github.com/purplecones/hereabove-content/tree/main/content/craft/transit/starter-subway-car"
    ]
  }
}
