{
  "dimensions": {
    "length": 180.0,
    "span": 30.0
  },
  "id": "starter-cargo-ship",
  "kind": "craft",
  "licence": "CC0-1.0",
  "matches": {
    "classes": [
      "cargo"
    ],
    "default": false,
    "types": []
  },
  "model": {
    "byteLimit": 78044,
    "format": "glb",
    "id": "model",
    "path": "model.glb",
    "required": true,
    "sha256": "77b449fb9503fd0e896d5ed2b427482abdedaa4cb009eda72d6fe99373957fa7"
  },
  "name": "Container ship (starter)",
  "provenance": {
    "attribution": "Container ship (starter), original work by the Here Above project",
    "sources": [
      "https://github.com/purplecones/hereabove-content/tree/main/content/craft/vessels/starter-cargo-ship"
    ]
  }
}
